{
  "ctm_version": "2",
  "envelope": {
    "branch": "mixed-fixture",
    "at": "2026-09-20T12:00:00Z",
    "observed_at": "2026-09-20T12:00:00.000000Z",
    "schema_hash": "fixture",
    "scope": "tag:fylgja",
    "mapping": {
      "reader": "infrahub-dcim",
      "model": "opsmill/schema-library",
      "version": "26336e9"
    },
    "fidelity": [
      {
        "disposition": "approximated",
        "object": "interface.enabled",
        "source": "InterfacePhysical.status",
        "reason": "a port is enabled unless its status is disabled; the library's status is not an admin state"
      },
      {
        "disposition": "approximated",
        "object": "interface.mgmt_only",
        "source": "InterfacePhysical.role",
        "reason": "the management port is the port whose role is management; the library has no management-only flag"
      },
      {
        "disposition": "omitted",
        "object": "platform.version",
        "source": "DcimPlatform",
        "reason": "the library's platform carries no version"
      }
    ]
  },
  "devices": [
    {
      "name": "e1",
      "platform": {
        "package": "arista_eos"
      },
      "interfaces": [
        {
          "name": "Ethernet1",
          "mgmt_only": false,
          "enabled": true,
          "link": "e1:Ethernet1|s1:ethernet-1/1"
        },
        {
          "name": "Ethernet2/1",
          "mgmt_only": false,
          "enabled": true,
          "link": "e1:Ethernet2/1|e2:Ethernet1"
        },
        {
          "name": "Management1",
          "mgmt_only": true,
          "enabled": true
        }
      ],
      "artifact": {
        "name": "device-config",
        "content_type": "text/plain",
        "checksum": "6b31a6de32516a4becb79002db56b1f7",
        "content": "! e1: production configuration rendered by Infrahub (fylgja-artifacts)\n! platform Arista EOS; FYLGJA-MARKER-mixed-fixture\nhostname e1\ninterface Ethernet1\ndescription to s1 ethernet-1/1\nno shutdown\ninterface Ethernet2/1\ndescription to e2 Ethernet1\nno shutdown\n! Management1: out-of-band management, left to the platform\n"
      }
    },
    {
      "name": "e2",
      "platform": {
        "package": "arista_eos"
      },
      "interfaces": [
        {
          "name": "Ethernet1",
          "mgmt_only": false,
          "enabled": true,
          "link": "e1:Ethernet2/1|e2:Ethernet1"
        },
        {
          "name": "Ethernet3/1/1",
          "mgmt_only": false,
          "enabled": true,
          "link": "e2:Ethernet3/1/1|s1:ethernet-1/2"
        },
        {
          "name": "Management1",
          "mgmt_only": true,
          "enabled": true
        }
      ],
      "artifact": {
        "name": "device-config",
        "content_type": "text/plain",
        "checksum": "e6a46383814336980c408a48410105e3",
        "content": "! e2: production configuration rendered by Infrahub (fylgja-artifacts)\n! platform Arista EOS; FYLGJA-MARKER-mixed-fixture\nhostname e2\ninterface Ethernet1\ndescription to e1 Ethernet2/1\nno shutdown\ninterface Ethernet3/1/1\ndescription to s1 ethernet-1/2\nno shutdown\n! Management1: out-of-band management, left to the platform\n"
      }
    },
    {
      "name": "s1",
      "platform": {
        "package": "nokia_srlinux"
      },
      "interfaces": [
        {
          "name": "ethernet-1/1",
          "mgmt_only": false,
          "enabled": true,
          "link": "e1:Ethernet1|s1:ethernet-1/1"
        },
        {
          "name": "ethernet-1/2",
          "mgmt_only": false,
          "enabled": true,
          "link": "e2:Ethernet3/1/1|s1:ethernet-1/2"
        },
        {
          "name": "mgmt0",
          "mgmt_only": true,
          "enabled": true
        }
      ],
      "artifact": {
        "name": "device-config",
        "content_type": "text/plain",
        "checksum": "5e2a65f4dd4f5968c76e99f53fc3ff89",
        "content": "# s1: production configuration rendered by Infrahub (fylgja-artifacts)\n# platform Nokia SR Linux; FYLGJA-MARKER-mixed-fixture\nset / system name host-name s1\nset / network-instance default type default\nset / interface ethernet-1/1 description \"to e1 Ethernet1\"\nset / interface ethernet-1/1 admin-state enable\nset / interface ethernet-1/1 subinterface 0 admin-state enable\nset / network-instance default interface ethernet-1/1.0\nset / interface ethernet-1/2 description \"to e2 Ethernet3/1/1\"\nset / interface ethernet-1/2 admin-state enable\nset / interface ethernet-1/2 subinterface 0 admin-state enable\nset / network-instance default interface ethernet-1/2.0\n# mgmt0: out-of-band management, left to the platform\n"
      }
    }
  ],
  "links": [
    {
      "id": "e1:Ethernet1|s1:ethernet-1/1",
      "endpoints": [
        {
          "device": "e1",
          "interface": "Ethernet1"
        },
        {
          "device": "s1",
          "interface": "ethernet-1/1"
        }
      ]
    },
    {
      "id": "e1:Ethernet2/1|e2:Ethernet1",
      "endpoints": [
        {
          "device": "e1",
          "interface": "Ethernet2/1"
        },
        {
          "device": "e2",
          "interface": "Ethernet1"
        }
      ]
    },
    {
      "id": "e2:Ethernet3/1/1|s1:ethernet-1/2",
      "endpoints": [
        {
          "device": "e2",
          "interface": "Ethernet3/1/1"
        },
        {
          "device": "s1",
          "interface": "ethernet-1/2"
        }
      ]
    }
  ]
}
